{"schema_version":1,"adapter_kind":"test-memory","profile":"task_source","passed":1,"failed":0,"skipped":0,"setup_failed":0,"probe_failed":0,"cleanup_failed":0,"case_results":[{"id":"case-1","operation":"task_source.fetch_candidates","status":"passed","request_id":"req-1","message":"ok [REDACTED]","diagnostics":"diag [REDACTED]"}],"hook_results":[{"phase":"setup","status":"passed","message":"setup ok [REDACTED]","diagnostics":"setup diag [REDACTED]"}],"probe_results":[{"name":"probe-1","status":"passed","message":"probe ok [REDACTED]","diagnostics":"probe diag [REDACTED]"}]}